,title/text,subreddit,cleaned_text
681,"Greetings all

I m currently using an iPhone 6s with 64GB of storage  of which I have used 50GB without ever having storage issues  I ve seen threads about iPhone storage capacity a couple of years ago  but since everything is moving so quickly I wanted to ask you all  How much storage space do you need in 2020 2025 

Initially I was leaning towards ordering my new iPhone 12 Pro in 128GB  but since I don t plan to upgrade again until around the year 2025  I started thinking if maybe 256GB would be better  considering iOS updates  future apps utilizing available storage standards  the new camera features of the iPhone 12 Pro  etc  

I m not typically a heavy user  but I m also a spontaneous user  and a couple times every year I travel which means I download enough music and podcasts on my phone to make sure I have a good variety of content to keep me entertained  I love taking pictures  but I m not a photographer  Sometimes I don t take a picture for weeks and other times I take a bunch of pictures in a single day  

So therefore I turn to you  the community  to pose this question  How much storage do you need on your iPhone and why 

Thanks in advance How much storage do you need on your iPhone in 2020 ",iphone,greeting currently using gb storage used gb without ever storage issue seen thread storage capacity couple year ago since everything moving quickly wanted ask much storage space need initially leaning towards ordering new pro gb since plan upgrade around year started thinking maybe gb would better considering io update future apps utilizing available storage standard new camera feature pro etc typically heavy user also spontaneous user couple time every year travel mean download enough music podcasts make sure good variety content keep entertained love taking picture photographer sometimes take picture week time take bunch picture single day therefore turn community pose question much storage need thanks advance much storage need
682,"So I m a die hard Android user   I have been thinking about switching to iPhone for a few months now as my entire family uses them and are always asking for help with them   Just makes sense to me 

How does the value of iPhones hold up   If I switch  it ll be paying full retail for the 12 Pro and if for some reason I just hate it  I d like to get most of the money back if possible  iPhones hold value better than Androids ",iphone,die hard user thinking switching month entire family us always asking help make sense value hold switch paying full retail pro reason hate like get money back possible hold value better android
683,"About to pull the trigger on the 12 Pro  currently have a OnePlus 7 Pro  

All that s stopping me and making me consider the Pixel 5 is the lack of USB C and the lower refresh rate  

Has anyone made this jump  if so how have you found it  Do you miss 90hz   Is the lack of 90 120hz noticeable ",iphone,pull trigger pro currently oneplus pro stopping making consider pixel lack usb c lower refresh rate anyone made jump found miss hz lack hz noticeable
684,Has anyone found a good magnetic car mount that works with MagSafe for the new iPhones  My old Spigen magnet mount is too small and fits inside the MagSafe circle so it doesn t work  I saw Belkin has one coming soon but not yet available  Anyone find a MagSafe car mount yet ,iphone,anyone found good magnetic car mount work magsafe new old spigen magnet mount small fit inside magsafe circle work saw belkin one coming soon yet available anyone find magsafe car mount yet
685,  Can anyone help ,iphone,anyone help
686,  I got the monthly AppleCare plan with my iPhone 12 and it says I won t be billed again until next year  Anyone else notice this ,iphone,got monthly applecare plan say billed next year anyone else notice
687,  Using MagSafe charger for AirPods ,iphone,using magsafe charger airpods
688,  How does the iPhone 12  Pro  feel in the hand ,iphone,pro feel hand
689,Last year I bought an iPhone 11 Pro from Apple through a trade in from an iPhone X bought from Swappa  With it  I bought Apple Care  that ll cover my device for two years  It expires mid November of 2021  I m considering purchasing an iPhone 12 Pro Max through the trade in program that Apple is offering  My question is will my Apple Care  coverage transfer over to the new device automatically  or do I have to reach out to Apple themselves to get that done  Apple Care  Coverage Transfer ,iphone,last year bought pro apple trade x bought swappa bought apple care cover device two year expires mid november considering purchasing pro max trade program apple offering question apple care coverage transfer new device automatically reach apple get done apple care coverage transfer
690,"I very often use the app Notes  which has no own interface for Undo Redo itself and I always got annoyed when I deleted something by mistake 

Swipe left with three fingers to undo 

Swipe right with three fingers to redo 

Double tapping with three fingers opens a little menu with the controls 

EDIT  You can use it wherever you can enter text  e g  the Reddit App text fields or in Safari s search bar and so forth 

EDIT2  As pointed out by u 13x666 

 Double tapping with three fingers opens a little menu with the controls    gt  Actually  single tap is enough 

 three finger pinch in to copy

 three finger double pinch in to cut

three finger pinch out to paste  TIL there are three finger gestures on iOS for undo  redo  cut  copy and paste ",iphone,often use app note interface undo redo always got annoyed deleted something mistake swipe left three finger undo swipe right three finger redo double tapping three finger open little menu control edit use wherever enter text e g app text field safari search bar forth edit pointed u x double tapping three finger open little menu control gt actually single tap enough three finger pinch copy three finger double pinch cut three finger pinch paste til three finger gesture io undo redo cut copy paste
691,"Thought I would make iPhone 12 Pro users aware of a software bug that breaks wireless charging and requires a full reboot to enable wireless charging again  

Within the first few hours of unboxing my iPhone 12 Pro this evening  the wireless charging functionality simply stopped working completely  Neither MagSafe chargers nor standard QI wireless chargers would charge the device  I m not sure what triggered it  but I had only been using MagSafe prior to the wireless charging functionality breaking  after which I confirmed that standard QI wireless charging also didn t work  It required a full reboot of the phone to bring wireless charging back 

Seems like a fairly large software glitch on Apple s part for their brand new flagship phone 
I m sure this will be patched in a future software release  but thought I d share the experience in case anyone else runs into the same bug  Discovered wireless charging bug with iPhone 12 Pro",iphone,thought would make pro user aware software bug break wireless charging requires full reboot enable wireless charging within first hour unboxing pro evening wireless charging functionality simply stopped working completely neither magsafe charger standard qi wireless charger would charge device sure triggered using magsafe prior wireless charging functionality breaking confirmed standard qi wireless charging also work required full reboot bring wireless charging back seems like fairly large software glitch apple part brand new flagship sure patched future software release thought share experience case anyone else run bug discovered wireless charging bug pro
692,"I ve been trying to find some more information on that dock that charges both Apple Watch and iPhone and folds to be compact and I m starting to feel like I ve seen a ghost because I can t seem to find much info about it  If anyone has any info like a release date or something I may have mentioned  that d be awesome 

 amp  x200B 

Thanks  What happened to the folding Apple Watch MagSafe dock they showed off in the reveal ",iphone,trying find information dock charge apple watch fold compact starting feel like seen ghost seem find much info anyone info like release date something may mentioned awesome x b thanks happened folding apple watch magsafe dock showed reveal
693,I d like to see a small capacity battery bank that supports magsafe wireless charging connection  I did some google search and there are already battery banks that support magnetic connection via phone case with magnets inside  It d be convenient to use if you could slap the battery bank on the back of your phone and it stays connected  anyone anticipating for magsafe compatible wireless charging brick,iphone,like see small capacity battery bank support magsafe wireless charging connection google search already battery bank support magnetic connection via case magnet inside convenient use could slap battery bank back stay connected anyone anticipating magsafe compatible wireless charging brick
694,"I didn t read too far into the topic  but from what I ve seen there are some things that make me wonder why people love this so much  

  from Posts I ve read it seems to be pretty slow charging process  Sure  charging it over night wouldn t make a difference  But a quick charge during the day takes longer than with a normal cable from I ve read  Or did I read the wrong posts  

  some phones or cases seem to get like a branding from the metal of magnet on the back of the phone  Not a nice thing to have   

  you still need a cable even when you do magsafe charging  

So what is the reason people are using this  What are the pros  Or is it just the  new cool thing to have   Why are people here such fans of MagSafe ",iphone,read far topic seen thing make wonder people love much post read seems pretty slow charging process sure charging night make difference quick charge day take longer normal cable read read wrong post phone case seem get like branding metal magnet back nice thing still need cable even magsafe charging reason people using pro new cool thing people fan magsafe
695,"This tool used to be amazing  I could easily take stills of tiny electronics and they would come out sharp and detailed   perfect for diagnosing solder issues and reading part numbers on chips 

Examples  here  https   imgur com LHXRJhJ png  and  here  https   imgur com 49d9UDh png 

Now I take a snapshot and it looks awful   Before  https   imgur com 56FPw12 png  the snapshot and  after  https   imgur com sVdvXDh png 

It s like as soon as it takes a snapshot it applies a poop filter and smears all the pixels around  It s also buggy and often stops working with multitouch  and the various controls often disappear  Accessibility Magnifier is so much worse now",iphone,tool used amazing could easily take still tiny electronics would come sharp detailed perfect diagnosing solder issue reading part number chip example http imgur lhxrjhj png http imgur udh png take snapshot look awful http imgur fpw png snapshot http imgur svdvxdh png like soon take snapshot applies poop filter smear pixel around also buggy often stop working multitouch various control often disappear accessibility magnifier much worse
696,  Found out via TikTok that the iPhone 12 LiDAR can automatically tell heights when a face is recognized ,iphone,found via tiktok lidar automatically tell height face recognized
697,"I ve been trying to wrap my head around this for a week now  Why do we want magnetic mounted wireless charging  The whole purpose of the wireless charger was grab and go  Put your phone down with no added energy  it charges  Pick it up and walk away and it s charged  Now you re tethered to the charger and it s back to square one with wired charging  You have to pull the charger off of your phone    what s the point 

Wireless charging can t transfer data  so it s going to be a shock if Apple has future plans to remove the port entirely  
Plus no wireless charger comes close to the charging capabilities of usb c at the moment  

Edit  I guess the best use is in mounted wireless car chargers  Perfect way for companies to save on new r amp d because Apple gave them the built in magnet  Pretty much redesign the MagSafe charger with stronger magnets and a dash mount or vent mount and you re selling millions  Why use the MagSafe charger ",iphone,trying wrap head around week want magnetic mounted wireless charging whole purpose wireless charger grab go put added energy charge pick walk away charged tethered charger back square one wired charging pull charger point wireless charging transfer data going shock apple future plan remove port entirely plus wireless charger come close charging capability usb c moment edit guess best use mounted wireless car charger perfect way company save new r apple gave built magnet pretty much redesign magsafe charger stronger magnet dash mount vent mount selling million use magsafe charger
698,"5G promises super high speeds  higher than LTE s 100 200 Mbps typical speeds  However  to stream 4K video  which most people don t do on their phones   you need a maximum of 25 Mbps  usually lower   So there is no reason to be able to download at 1Gbps on the go  The only reason I ve seen it used so far is for running speed  

You might say   it s to make it future proof   But I doubt that even 5 6 years in the future we ll need more than 60Mbps  which is much lower than what 4G is capable of  

5G is overrated and overhyped  and no one will use it to its potential benefit over 4G apart from saying  ooh  look at those crazy speeds  or simply for bragging rights   Unpopular opinion  5G is overrated and overhyped  and no one needs it",iphone,g promise super high speed higher lte mbps typical speed however stream k video people phone need maximum mbps usually lower reason able download gbps go reason seen used far running speed might say make future proof doubt even year future need mbps much lower g capable g overrated overhyped one use potential benefit g apart saying ooh look crazy speed simply bragging right unpopular opinion g overrated overhyped one need
699,"Is anyone doing a continually running analysis of all the iPhone cameras by generation   I m curious to see the improvements I d see going from an 8 Plus to 12 Pro 12 Pro Max 

I ve still got all my 3G  4S  6 and 8 Plus photos on my phone but I d be curious to see some controlled comparisons  iPhone Camera performance by generation ",iphone,anyone continually running analysis camera generation curious see improvement see going plus pro pro max still got g plus photo curious see controlled comparison camera performance generation
700,"The flat sides dig into my palm and just don t feel as comfortable as the rounded sides on the X and 11 series phones did  

Anyone else feel the same way  Anyone else think the 12 is uncomfortable ",iphone,flat side dig palm feel comfortable rounded side x series phone anyone else feel way anyone else think uncomfortable
701,"Trying to settle am argument 

Which has the better camera   the 11 Pro or the 12 

I know the 12 Pro has the best camera options but the price is just too high 

So if you were forced to pick an 11 Pro v the 12 based solely on the camera which would it be and why  Which has the best camera ",iphone,trying settle argument better camera pro know pro best camera option price high forced pick pro v based solely camera would best camera
702,I absolutely love the subtle click on the new iPhone when you lock your phone  I don t know why I m so excited about this  but I m really enjoying it  iPhone 12 Pro Subtle Click,iphone,absolutely love subtle click new lock know excited really enjoying pro subtle click
703,"Just want to test the two sizes before ordering one  

Have a XS Max so I want to compare Are iPhone 12 Pro Max models in Apple Stores ",iphone,want test two size ordering one x max want compare pro max model apple store
704,Does anyone noticed much of a different on the pro with the extra 2GB of ram  6GB ram,iphone,anyone noticed much different pro extra gb ram gb ram
705,Apparently  due to the SE 2 having haptic instead of 3D Touch it can t support live wallpapers  However  the new iPhone 12 also has Haptic Touch and has live wallpapers on it  Am i wrong or is this just an SE 2 issue  iPhone SE 2020 Live Wallpaper ,iphone,apparently due se haptic instead touch support live wallpaper however new also haptic touch live wallpaper wrong se issue se live wallpaper
706,Looking for a case for my iPhone 12 and am wondering if my phone will still be compatible with my MagSafe charger if I don t get a MagSafe case  MagSafe case required ,iphone,looking case wondering still compatible magsafe charger get magsafe case magsafe case required
707,My iPhone 8 Plus  top speaker has way worse quality compared to the bottom one  is it normal or they should sound exactly the same  Is the ear speaker  the one close to the selfie camera  sound quality the same as the bottom one on the iPhone 8 Plus ,iphone,plus top speaker way worse quality compared bottom one normal sound exactly ear speaker one close selfie camera sound quality bottom one plus
708,How the build quality and the fitting  In the past I ve had some units of previous models with lose fitting  so the buttons would rattle a bit  Wondering how the fitting and build quality regarding buttons  moving parts  is with iPhone 12  Pro  TIA  iPhone 12 button build quality,iphone,build quality fitting past unit previous model lose fitting button would rattle bit wondering fitting build quality regarding button moving part pro tia button build quality
709,"I work in retail  so I ve been able to see all the colors of the new 12 models stacked up against eachother  And while I was really excited to go for the blue 12 Pro  I m now actually second thinking my decision  

Because of the super shiny  fingerprint magnet that the Stainless Steel is  coupled with the flat design of it opposed to the curve of the 11 Pro  it actually looks really REALLY cheap  I can t bring myself to enjoy the look  Anyone else feel the same way  I actually feel the aluminum on the standard 12 looks better  I wish they went with a bit of a more brushed stainless steel  but understand that wouldn t have provided much of a different look than the aluminum on the 12 

I know I m gonna throw a case on it  but just can t help but feel a bit disappointed in how toy like it looks  Anyone a bit underwhelmed not like the way the Stainless Steel on the 12 Pro looks ",iphone,work retail able see color new model stacked eachother really excited go blue pro actually second thinking decision super shiny fingerprint magnet stainless steel coupled flat design opposed curve pro actually look really really cheap bring enjoy look anyone else feel way actually feel aluminum standard look better wish went bit brushed stainless steel understand provided much different look aluminum know gonna throw case help feel bit disappointed toy like look anyone bit underwhelmed like way stainless steel pro look
710,See title Will the Leather Case releasing on 11 6 have a wallet slot embedded ,iphone,see title leather case releasing wallet slot embedded
711,"My 11 pro often drops the signal on the second floor of my house  My 8  never had this issue  Apparently this is a common issue with Wi Fi on the 11 pro  Is the 12 pro or 12 better at catching Wi Fi signals and maintaining them 

UPDATE  Got the IPhone 12 Pro and have 0 issues with connecting to Wifi now and maintaining the signal on the second level of my home  I had two iPhone 11 pros  exchanged one  and they both had a hard time with maintaining wifi signals when I would be on the 2nd floor of my house  If anyone has a similar problem  you will not most likely not encounter it while using the iPhone 12 pro  possibly the regular 12 as well   Is the IPhone 12 pro better at maintaining wifi signals than the 11 pro ",iphone,pro often drop signal second floor house never issue apparently common issue wi fi pro pro better catching wi fi signal maintaining update got pro issue connecting wifi maintaining signal second level home two pro exchanged one hard time maintaining wifi signal would nd floor house anyone similar problem likely encounter using pro possibly regular well pro better maintaining wifi signal pro
712,"I was about to cancel my order today but apple had already shipped it  I m planning on returning it regardless because after some digging around  the Pro Max will be a better choice for my needs  and for what it seems  it s about the same size as my current 8 Plus  so it shouldn t feel that overwhelming except of course for the fact that the whole thing is going to be mostly screen 

Anyone else in a similar situation  Anyone on the fence about returning the 12 Pro and wait for the PM ",iphone,cancel order today apple already shipped planning returning regardless digging around pro max better choice need seems size current plus feel overwhelming except course fact whole thing going mostly screen anyone else similar situation anyone fence returning pro wait pm
713,  iPhone 12 owners  hows the sharp edges feel in your hand compared to curved edges of previous iphones ,iphone,owner hows sharp edge feel hand compared curved edge previous
