,title/text,subreddit,cleaned_text
0,"Welcome to the Daily Tech Support thread for  r iphone  

Have a question you need answered  Ask away  Please remember to adhere to our rules  which can be found in the sidebar  As usual  if you have a serious issue with the subreddit  please contact  the moderators directly   https   www reddit com message compose to  2Fr 2Fiphone 

Please be informed that any questions about bypassing iCloud lock   or anything similar that may infer that you are trying to get access to a locked iPhone  are no longer allowed and will be removed  Thank you 

Check our  Tech Support FAQ page  https   www reddit com r iphone wiki support faq 

Join our Discord room for support 

 Discord  https   discord gg iphone 

  Note  Comments are sorted by  new for your convenience   

This is the previous  archive  https   www reddit com r iphone search q title 3A 22Daily Tech Support Thread 22 author 3A 22AutoModerator 22 amp restrict_sr on amp sort new amp t all  of all previous  Daily Tech Support  threads  This is best viewed on a browser  If on mobile  type on the searchbar  title  Daily Tech Support Thread  author  AutoModerator    without the brackets  and including the quotation marks around the title and author     

Here is a previous  archive  https   www reddit com r iphone search q title 3A 22Weekly Tech Support Thread 22 author 3A 22AutoModerator 22 amp restrict_sr on amp sort new amp t all  of all previous  Weekly Tech Support  threads  which has now changed to Daily Tech Support Thread  This is best viewed on a browser  If on mobile  type on the searchbar  title  Weekly Tech Support Thread  author  AutoModerator    without the brackets  and including the quotation marks around the title and author   Daily Tech Support Thread    November 26 ",iphone,welcome daily tech support r question need answered ask away please remember adhere rule found sidebar usual serious issue subreddit please contact moderator directly http message compose fr fiphone please informed question bypassing icloud lock anything similar may infer trying get access locked longer allowed removed thank check tech support faq page http r wiki support faq join discord room support discord http discord gg note comment sorted new convenience previous archive http r search q title daily tech support author automoderator restrict sr sort new previous daily tech support thread best viewed browser mobile type searchbar title daily tech support author automoderator without bracket including quotation mark around title author previous archive http r search q title weekly tech support author automoderator restrict sr sort new previous weekly tech support thread changed daily tech support best viewed browser mobile type searchbar title weekly tech support author automoderator without bracket including quotation mark around title author daily tech support november
1,"I have hooked up a MagSafe charger in my car and connected it to a third party USB C cigarette lighter plug

Even with the engine turned off the cigarette lighter continues to deliver power to the MagSafe puck  

I sometimes go a week or two without using my car  Would it be possible that the passive power draw of the MagSafe puck could run my car engine down  Or is the power draw so minimal that I have nothing g to worry about  How much power does MagSafe draw when there is no iPhone attached  Enough to flatten my car battery ",iphone,hooked magsafe charger car connected third party usb c cigarette lighter plug even engine turned cigarette lighter continues deliver power magsafe puck sometimes go week two without using car would possible passive power draw magsafe puck could run car engine power draw minimal nothing g worry much power magsafe draw attached enough flatten car battery
2,Hi guys  if I was to buy a iphone second hand but brand new in sealed condition would the person selling me the phone be able to claim insurance and block the phone that was sold to me  essentially leaving me with a useless phone  Please help  Advice needed,iphone,hi guy buy second hand brand new sealed condition would person selling able claim insurance block sold essentially leaving useless please help advice needed
3,Hello everyone  I have the iPhone 11 and until now I m keeping it on iOS 13 9 because the battery is very good and everything works good  in Italy we say  don t change the team that wins   but I m wondering  does iOS 14 on the 11 have any known issues  like battery shorter etc   Because usually it is like that in the first versions of a new OS iPhone 11 iOS14,iphone,hello everyone keeping io battery good everything work good italy say change team win wondering io known issue like battery shorter etc usually like first version new o io
4,"Proud owner of a new iPhone 11 Pro   First time in a long time I ve used a phone without a case  so I m not sure if that s the reason I m noticing it  but the volume up button sticks out further than the volume down  which is basically flush to the side of the phone  

There s no functionality issues  and no tactile feedback issues as far as I can tell  so it seems like a design decision  But I m not 100  and I can t find anything about it on the web  Super dumb question  iPhone 11 Pro owners  Do your volume rockers stick out evenly ",iphone,proud owner new pro first time long time used without case sure reason noticing volume button stick volume basically flush side functionality issue tactile feedback issue far tell seems like design decision find anything web super dumb question pro owner volume rocker stick evenly
5,Is there a way to lock the screen so that it still plays but doesn t respond to touch  Is there a setting on the iPhone that locks the screen  from touch  ,iphone,way lock screen still play respond touch setting lock screen touch
6,"My current iphone works fine  but I was thinking about buying the 12 MAX for the camera  However  I don t know if I should dish out the cash for the iphone or just buy a DSLR with that cash  If we were to compare the iphone 12 MAX s camera to a DSLR  which one would it be 

EDIT  

Thank you for the speedy reply  Looks like I ll begin looking for a DSLR that fits my needs 

Also  I m absolutely loving the analogies lol They helped paint a better picture in my non camera savvy mind  iphone 12 MAX camera vs DSLR",iphone,current work fine thinking buying max camera however know dish cash buy dslr cash compare max camera dslr one would edit thank speedy reply look like begin looking dslr fit need also absolutely loving analogy lol helped paint better picture non camera savvy mind max camera v dslr
7,  Best part of working in radiology is using my iPhone 12 Pro Max to test the X ray tube  I figured I d share the insides  Look at the sensor shift stabilizer around the 3rd camera ,iphone,best part working radiology using pro max test x ray tube figured share inside look sensor shift stabilizer around rd camera
8,"I am really excited with iOS 14 s new Back Tap feature  I think this feature isn t even on most people s radar  It finally brings what I always wanted in an iPhone the ability to quickly open up apps without having to swipe or search for them 

It allows me to set up a shortcut to quickly open up my to do list app  it even works from within any app    just by tapping the back of my iPhone  If you haven t yet  definitely give it a try  If you need any help  I wrote about how to set it up here 
 How to set up quick capture with Back Tap on iOS 14  https   link medium com Ps5zgI1oHbb  
I got it set up where 
Double Tap   gt  opens up To do list app
Triple tap   gt  opens up my calorie counting app
I am curious if or how other people are using this  feature  Is Back Tap iOS 14 s most underrated feature ",iphone,really excited io new back tap feature think feature even people radar finally brings always wanted ability quickly open apps without swipe search allows set shortcut quickly open list app even work within app tapping back yet definitely give try need help wrote set set quick capture back tap io http link medium p zgi ohbb got set double tap gt open list app triple tap gt open calorie counting app curious people using feature back tap io underrated feature
9,  iOS 14 2 Music Player  Anyone else hate this new look  especially with the app icon on the album art ,iphone,io music player anyone else hate new look especially app icon album art
10,What do you think it will have by then  Predict the 2025 iPhone,iphone,think predict
11,"Hi iphone 12 pro   pro max users
I have a question
Does the iphone have the night mode option for portrait photos  Back and front camera 

I ve seen that night mode is not enable in the telephoto 2x or 2 5x camera  Is this true   

Thanks a lot  Iphone 12 pro night mode question",iphone,hi pro pro max user question night mode option portrait photo back front camera seen night mode enable telephoto x x camera true thanks lot pro night mode question
12,  Kuo  iPhone 12 demand strong  new form factor Apple Watch and MacBooks in late 2021,iphone,kuo demand strong new form factor apple watch macbooks late
13,So since  the iphone s screen 5 4 but it s ultra wide  the videos are not full screen and instead have black bars on each side  so how large is the effective video size  I m guessing around 4 8 inches but I can t really find out  How big is the effective iphone 12 mini screen while playing videos ,iphone,since screen ultra wide video full screen instead black bar side large effective video size guessing around inch really find big effective mini screen playing video
14,  Apple iPhone 12 material cost is about  373  12 Pro cost is  406,iphone,apple material cost pro cost
15,"Welcome to the Daily Tech Support thread for  r iphone  

Have a question you need answered  Ask away  Please remember to adhere to our rules  which can be found in the sidebar  As usual  if you have a serious issue with the subreddit  please contact  the moderators directly   https   www reddit com message compose to  2Fr 2Fiphone 

Please be informed that any questions about bypassing iCloud lock   or anything similar that may infer that you are trying to get access to a locked iPhone  are no longer allowed and will be removed  Thank you 

Check our  Tech Support FAQ page  https   www reddit com r iphone wiki support faq 

Join our Discord room for support 

 Discord  https   discord gg iphone 

  Note  Comments are sorted by  new for your convenience   

This is the previous  archive  https   www reddit com r iphone search q title 3A 22Daily Tech Support Thread 22 author 3A 22AutoModerator 22 amp restrict_sr on amp sort new amp t all  of all previous  Daily Tech Support  threads  This is best viewed on a browser  If on mobile  type on the searchbar  title  Daily Tech Support Thread  author  AutoModerator    without the brackets  and including the quotation marks around the title and author     

Here is a previous  archive  https   www reddit com r iphone search q title 3A 22Weekly Tech Support Thread 22 author 3A 22AutoModerator 22 amp restrict_sr on amp sort new amp t all  of all previous  Weekly Tech Support  threads  which has now changed to Daily Tech Support Thread  This is best viewed on a browser  If on mobile  type on the searchbar  title  Weekly Tech Support Thread  author  AutoModerator    without the brackets  and including the quotation marks around the title and author   Daily Tech Support Thread    November 25 ",iphone,welcome daily tech support r question need answered ask away please remember adhere rule found sidebar usual serious issue subreddit please contact moderator directly http message compose fr fiphone please informed question bypassing icloud lock anything similar may infer trying get access locked longer allowed removed thank check tech support faq page http r wiki support faq join discord room support discord http discord gg note comment sorted new convenience previous archive http r search q title daily tech support author automoderator restrict sr sort new previous daily tech support thread best viewed browser mobile type searchbar title daily tech support author automoderator without bracket including quotation mark around title author previous archive http r search q title weekly tech support author automoderator restrict sr sort new previous weekly tech support thread changed daily tech support best viewed browser mobile type searchbar title weekly tech support author automoderator without bracket including quotation mark around title author daily tech support november
16,  AppIconz   Now on the AppStore,iphone,appiconz appstore
17,  iPhone 12 Pro Max  iPhone 12 mini driving stronger demand in December quarter,iphone,pro max mini driving stronger demand december quarter
18,  Our predictions for the 2020 iPhone in 2014,iphone,prediction
19,"So I knew for sure that the 11Pro Max doesn t do night mode on the ultra wide  but I didn t know that night mode as off limits on the telephoto too 

Was just trying out some images last night  and I managed to trick it into actually switching to the 2x lens  and boom  Night mode was gone 

Night mode is entirely software  I wonder why it s restricted only to the standard wide lens  Kinda discovered that the 11 Pro max doesn t do night mode on the telephoto either ",iphone,knew sure pro max night mode ultra wide know night mode limit telephoto trying image last night managed trick actually switching x lens boom night mode gone night mode entirely software wonder restricted standard wide lens kinda discovered pro max night mode telephoto either
20,  Jeff Benjamin  The iPhone 12 mini is  in my honest opinion  the best looking and best functioning smartphone that I ve experienced in years,iphone,jeff benjamin mini honest opinion best looking best functioning smartphone experienced year
21,"Welcome to the Daily Tech Support thread for  r iphone  

Have a question you need answered  Ask away  Please remember to adhere to our rules  which can be found in the sidebar  As usual  if you have a serious issue with the subreddit  please contact  the moderators directly   https   www reddit com message compose to  2Fr 2Fiphone 

Please be informed that any questions about bypassing iCloud lock   or anything similar that may infer that you are trying to get access to a locked iPhone  are no longer allowed and will be removed  Thank you 

Check our  Tech Support FAQ page  https   www reddit com r iphone wiki support faq 

Join our Discord room for support 

 Discord  https   discord gg iphone 

  Note  Comments are sorted by  new for your convenience   

This is the previous  archive  https   www reddit com r iphone search q title 3A 22Daily Tech Support Thread 22 author 3A 22AutoModerator 22 amp restrict_sr on amp sort new amp t all  of all previous  Daily Tech Support  threads  This is best viewed on a browser  If on mobile  type on the searchbar  title  Daily Tech Support Thread  author  AutoModerator    without the brackets  and including the quotation marks around the title and author     

Here is a previous  archive  https   www reddit com r iphone search q title 3A 22Weekly Tech Support Thread 22 author 3A 22AutoModerator 22 amp restrict_sr on amp sort new amp t all  of all previous  Weekly Tech Support  threads  which has now changed to Daily Tech Support Thread  This is best viewed on a browser  If on mobile  type on the searchbar  title  Weekly Tech Support Thread  author  AutoModerator    without the brackets  and including the quotation marks around the title and author   Daily Tech Support Thread    November 24 ",iphone,welcome daily tech support r question need answered ask away please remember adhere rule found sidebar usual serious issue subreddit please contact moderator directly http message compose fr fiphone please informed question bypassing icloud lock anything similar may infer trying get access locked longer allowed removed thank check tech support faq page http r wiki support faq join discord room support discord http discord gg note comment sorted new convenience previous archive http r search q title daily tech support author automoderator restrict sr sort new previous daily tech support thread best viewed browser mobile type searchbar title daily tech support author automoderator without bracket including quotation mark around title author previous archive http r search q title weekly tech support author automoderator restrict sr sort new previous weekly tech support thread changed daily tech support best viewed browser mobile type searchbar title weekly tech support author automoderator without bracket including quotation mark around title author daily tech support november
22,"So I ve been using Android phones since about 10 years now  I ve seen the progression from 2 3 all the way up to 11 

Most recently  I had a Pixel 2XL  which I wanted to upgrade from  Google completely destroyed my dreams of having another Pixel because of 2 reasons 

1  They didn t launch the latest Pixel 5 in my region at all 
2  They were making budget phones  No flagship stuff 

I was thinking of OnePlus but the UI has started moving away from the clean stock android it used to be  I never wanted to use a Samsung because I absolutely abhor the One UI 

So I was  naturally  left with only one option  Turn over to the other side  Think Apple 

The biggest thing that has stopped me from getting an iPhone in the past was that

1  Complete lack of homescreen customisation  It would have driven me up walls if I had to use a phone where every single installed app is just lying on the homescreen with no way to clean it up  No widgets either  iOS 14 changed that  Finally you can run a clean home screen  and have an app drawer that s arguably better than Android 
2  Up until iPhone 11  the camera was just not at par with the Pixels overall  It had its redeeming points  but until 11  night sight was a complete miss  That changed too 

Thanks to these 2 changes  I even considered an iPhone  I timed it right  browsed the web a lot  and managed to get an iPhone 11 Pro Max 64GB for about 15  cheaper than the general market price 

It s been a month now  and here are a few thoughts 

1  The battery life is absolutely insane  I can go through about a day and more in a single charge  and that too without even charging past 90   My average screentime is like 4 5 hours a day  I m especially impressed by how little battery it consumes in traditionally power hungry tasks like photos  long videos  audio recordings  On standby it barely sips battery  This is the power of complete custom integration  and Google  I hope you learn this 
2  The cameras are fantastic  The images are usually a bit less contrast y than I used to get on my Pixel  but that s something I m getting used  What I noticed is that the iPhone captures far better dynamic range when there s enough light  The natural DoF on the cameras is so good  I m enjoying having an ultra wide and a proper 2x telephoto  I especially love the camera UI showing the areas just outside the current frame  Again  only possible through custom SoC integration power 
3  The videos are absolutely sublime  The stabilisation  the seamless switching between the lenses  I love it 
4  The UI  I have finally found the perfect UI  The left pane with some basic widgets  a single completely empty homescreen with 4 icons at the bottom  Thought I wish they were 5   and an app drawer that organises apps by category  Perfection  On Android I used to create folders on the home screen manually and categorise apps in them    Yikes 
5  Almost every single app that I used on Android is way better on iOS  Biggest betrayal being how much more usable Chrome is on iOS than Android  WTF Google  The apps are well designed  the long press actions are ahmazing 
6  Wireless charging  I used to be very skeptical of it before  But now I got an Aukey charging dock thingy  and I m loving the convenience 
7  Face ID  The speed is fantastic  and it s pretty seamless  I only wish you could just half swipe on the lock screen to unlock it  It s annoying having to swipe from the very bottom on a 6 5  screen  Also  the way the wireless dock is placed on my work desk  I can simply glance to the phone when I have a notification  and Face ID will instantly show me the notification content  That is pretty cool 
8  Though now in the mask era  Face ID is a bit annoying  I know that there are ways to enroll with the mask  but apart from that  I miss the finger print for its ease in such situations 
9  My only biggest gripe with the whole thing is that for some reason no app can differentiate between  folders  of sorts  I hate that downloaded media  media that I send through whatsapp  all get pooled with my camera photos  and if I enable backup  it will stupidly backup everything  I don t want that  The Apple  Photos  app does have different  albums   but there s no option to backup only the camera photos because there is no Camera  album   I have not found any workaround solution for this yet   I am aware that Whatsapp has a setting to disable saving to camera roll  But that only applies to incoming media  Media that I click in whatsapp and then send still gets saved to camera roll  

Overall  I m pretty damn happy I made the switch 

EDIT1  A couple of folks asked for how my homescreen setup currently looks like 

 https   gfycat com directfrighteninghuia  https   gfycat com directfrighteninghuia  Android user of 10 years  switched to an iPhone  Just some thoughts ",iphone,using phone since year seen progression way recently pixel xl wanted upgrade google completely destroyed dream another pixel reason launch latest pixel region making budget phone flagship stuff thinking oneplus ui started moving away clean stock used never wanted use samsung absolutely abhor one ui naturally left one option turn side think apple biggest thing stopped getting past complete lack homescreen customisation would driven wall use every single installed app lying homescreen way clean widget either io changed finally run clean home screen app drawer arguably better camera par pixel overall redeeming point night sight complete miss changed thanks change even considered timed right browsed web lot managed get pro max gb cheaper general market price month thought battery life absolutely insane go day single charge without even charging past average screentime like hour day especially impressed little battery consumes traditionally power hungry task like photo long video audio recording standby barely sip battery power complete custom integration google hope learn camera fantastic image usually bit le contrast used get pixel something getting used noticed capture far better dynamic range enough light natural dof camera good enjoying ultra wide proper x telephoto especially love camera ui showing area outside current frame possible custom soc integration power video absolutely sublime stabilisation seamless switching lens love ui finally found perfect ui left pane basic widget single completely empty homescreen icon bottom thought wish app drawer organises apps category perfection used create folder home screen manually categorise apps yikes almost every single app used way better io biggest betrayal much usable chrome io wtf google apps well designed long press action ahmazing wireless charging used skeptical got aukey charging dock thingy loving convenience face id speed fantastic pretty seamless wish could half swipe lock screen unlock annoying swipe bottom screen also way wireless dock placed work desk simply glance notification face id instantly show notification content pretty cool though mask era face id bit annoying know way enroll mask apart miss finger print ease situation biggest gripe whole thing reason app differentiate folder sort hate downloaded medium medium send whatsapp get pooled camera photo enable backup stupidly backup everything want apple photo app different album option backup camera photo camera album found workaround solution yet aware whatsapp setting disable saving camera roll applies incoming medium medium click whatsapp send still get saved camera roll overall pretty damn happy made switch edit couple folk asked homescreen setup currently look like http gfycat directfrighteninghuia http gfycat directfrighteninghuia user year switched thought
23,  Apple s official iPhone cases on sale from  10 across various styles,iphone,apple official case sale across various style
24,"Hi  I got an iPhone 12 Pro Max and today I shot the first random video of my mom s dog in HDR 

I noticed that in the photos app the display turns to max  I guess   brightness while playing the video  even if it doesn t show in the system brightness bar 

I know that you need max brightness to enjoy HDR so it would make sense  I just wanted to know if anyone else noticed the same thing and if I m right or if it s just an impression of mine  iPhone 12 Pro Max video playback brightness",iphone,hi got pro max today shot first random video mom dog hdr noticed photo app display turn max guess brightness playing video even show system brightness bar know need max brightness enjoy hdr would make sense wanted know anyone else noticed thing right impression mine pro max video playback brightness
