,title/text,subreddit,cleaned_text
394,"Hello 

Thank you in advance for your wisdom and help 

Yesterday my son and I bought an iPhone 12 for my wife   she had been using  6s Plus  for the last 4 years  and it s began acting up   Our son wanted to surprise Mom with an early  Anniversary   Thanksgiving   Christmas  present   He has autism  and this was one of the forest times he wanted get mom something before wanting something new for himself   He also felt  really  excited at being approved for the loan   
He and I agreed beforehand that for this to happen  he needed to own the loan approval    He and I are splitting the  46 monthly payments  
Mom s upset today because of the money involved  and claims she doesn t see the benefits of having a phone that is about the same size 
Sigh 
I m in  IT and my explanations of why this is the better phone aren t working   Can you give me some layman s wording to describe how why the newer phone is the better one to have 

Thank you  Which One to Keep ",iphone,hello thank advance wisdom help yesterday son bought wife using plus last year began acting son wanted surprise mom early anniversary thanksgiving christmas present autism one forest time wanted get mom something wanting something new also felt really excited approved loan agreed beforehand happen needed loan approval splitting monthly payment mom upset today money involved claim see benefit size sigh explanation better working give layman wording describe newer better one thank one keep
395," 

I ve been a long time user of Android phones due to their affordability and customization  My first flagship Android phone was the Galaxy s3  I immediately fell in love with the design and overall functionality  All my friends and family would have iphones  but I would always stay true to Androids  Then I upgraded to the Galaxy s6 right before I left for college  At this point  I was a little bit upset as Androids weren t  and still aren t  optimized for Snapchat  as this is when my social life started to sky rocket  so much of my time was spent on that app 

2 years later in 2017 I switch to the Galaxy s8  Now  I loved this phone and it s been a killer 3 years with it  Awesome camera  lightning fast  amazing customization UI and just overall enjoyment 

I would always look over the fence though and see what Apple was up to with their iphones  and my friends would constantly brag about just how well optimized and user friendly their iphones were  I was never one to delve deep into unlocking Androids  true potential and being a power user  but I wasn t a grandma either 

Fast forward to 2020  I hear about the iphone 12 and its return to the iphone 4 design  which was my absolute favorite looking iphone   I was never a fan of the  rounded  iphones   This  combined with the fact that my S8 was not only coming on 3 years old now   the iphones and Galaxy series of phones cost about the same  made me switch 

  THOUGHTS  

I got my new Iphone 12 pro about 3 days ago 

  Cons  

I power it on and start setting everything up  I m a little disappointed by the screen resolution and detail  but it s not a major step down from my S8  Another big factor that contributed toward me switching was the fact that Apple decided to add widgets  I was a bit surprised in the fact that there is no Alarm clock or Email widget  but i ll make due  Another feature that disappoints me is the fact that there is no dedicated  back arrow  on the bottom right of the screen like with androids  It s either gesture controlled or a you have to reach to the top left of the screen to return somewhere  Something I did with my old S8 that greatly improved speeds was turn off unnecessary animations  like apps opening      A feature i m not sure is available on Apple products   

  Pros  

When I first took the phone out of the box  I was immediately impressed by the phones weight and build  This thing truly feels like it can take a beating and then some  The true tone display is very nice and color accuracy is impressive  The camera  as expected  is absolutely stunning  I took my first night mode picture last night and im blown away by the clarity and resolution a phone camera is able to reach  Snaps on snapchat look crystal clear  Granted  this is mostly due to the fact that Snapchat is well optimized for iphones   and zooming in no longer blurs pictures to the extent my older Androids did  Having long term software support is also another massive plus  The phone is not only remarkably faster  but the battery life is muuuuuch better than my old S8  Obviously  this is going to be the case no matter which new phone you get when you compare it to an old one though  Imessage is awesome and I love the animjoi feature as well  Lastly  Iphones tend to hold their value pretty well  which is really nice

  Overall Impressions  

The iphone 12 pro is an amazing phone  I love its new throwback design along with its true tone display and impressive camera  However  there was something homey about Android  Something I can t quite put my finger on that I miss  Maybe I need more time with my iphone and get more familiar with its features and quirks  as it s only been about 3 days  But overall im very excited with my switch  10  Years of Android ownership  Just switched to iphone 12 Pro  My thoughts first impressions",iphone,long time user phone due affordability customization first flagship galaxy immediately fell love design overall functionality friend family would would always stay true android upgraded galaxy right left college point little bit upset android still optimized snapchat social life started sky rocket much time spent app year later switch galaxy loved killer year awesome camera lightning fast amazing customization ui overall enjoyment would always look fence though see apple friend would constantly brag well optimized user friendly never one delve deep unlocking android true potential power user grandma either fast forward hear return design absolute favorite looking never fan rounded combined fact coming year old galaxy series phone cost made switch thought got new pro day ago con power start setting everything little disappointed screen resolution detail major step another big factor contributed toward switching fact apple decided add widget bit surprised fact alarm clock email widget make due another feature disappoints fact dedicated back arrow bottom right screen like android either gesture controlled reach top left screen return somewhere something old greatly improved speed turn unnecessary animation like apps opening feature sure available apple product pro first took box immediately impressed phone weight build thing truly feel like take beating true tone display nice color accuracy impressive camera expected absolutely stunning took first night mode picture last night im blown away clarity resolution camera able reach snap snapchat look crystal clear granted mostly due fact snapchat well optimized zooming longer blur picture extent older android long term software support also another massive plus remarkably faster battery life muuuuuch better old obviously going case matter new get compare old one though imessage awesome love animjoi feature well lastly tend hold value pretty well really nice overall impression pro amazing love new throwback design along true tone display impressive camera however something homey something quite put finger miss maybe need time get familiar feature quirk day overall im excited switch year ownership switched pro thought first impression
396,I m thinking of a case for my XR with MagSafe like magnets that could attach to the MagSafe charger and Wallet and have them function the same as with an iPhone 12  Any chance someone makes non iPhone 12 accessories with magnets compatible with MagSafe ,iphone,thinking case xr magsafe like magnet could attach magsafe charger wallet function chance someone make non accessory magnet compatible magsafe
397,Going caseless for the first time in awhile for my new iphone 12 pro  for those of you also going caseless  how do you hold it in the car   Any phone mounts you recommend   I would like CarPlay to work so need to plug the lightning cable in and not sure where to keep my unprotected phone  caseless or naked iphone  where to you place it in the car ,iphone,going caseless first time awhile new pro also going caseless hold car mount recommend would like carplay work need plug lightning cable sure keep unprotected caseless naked place car
398,So I got my 11 Pro Max replaced a few months ago so I m still at 100  battery capacity so the battery is basically god tier  I m thinking about getting a 12 Pro to go with my Note 20U but I don t really wanna sacrifice battery life too much  Opinions on the 12 Pro s battery specifically from former 11 Pro Max owners ,iphone,got pro max replaced month ago still battery capacity battery basically god tier thinking getting pro go note u really wanna sacrifice battery life much opinion pro battery specifically former pro max owner
399,  iPhone 12 Pro LiDAR makes AR super accurate even in very non ideal lighting conditions ,iphone,pro lidar make ar super accurate even non ideal lighting condition
400,"For example  paper clips  etc  Planning an upgrade but my line of work sometimes brings my phone  and me  on close proximity to metallic shavings and rust  

I m not keen on a circle of scratched phone  Does the iPhone 12 pick up metallic things ",iphone,example paper clip etc planning upgrade line work sometimes brings close proximity metallic shaving rust keen circle scratched pick metallic thing
401,For anyone interested on how the wallet holds up I ve been using mine for about a day now and it is fairly secure  It really does depend on how tight your pants are  Personally I wear slim pants so they re a little loose and so far I haven t had an issue with the wallet coming loose  You could even hold the phone solely by the wallet and it will not fall but I will mention I use my phone with a MagSafe case so that may be a factor  MagSafe Wallet,iphone,anyone interested wallet hold using mine day fairly secure really depend tight pant personally wear slim pant little loose far issue wallet coming loose could even hold solely wallet fall mention use magsafe case may factor magsafe wallet
402,  AR on the iPhone 12 Pro is incredible  There s a demon in my dining room ,iphone,ar pro incredible demon dining room
403,  New Apple event announced for next week,iphone,new apple event announced next week
404,Title says it Is there a widget app that doesnt have the name of the app below the widgets ,iphone,title say widget app doesnt name app widget
405,  Apple Now Offering iPhone 12 Mini and Pro Max Pre Approval for iPhone Upgrade Program Customers,iphone,apple offering mini pro max pre approval upgrade program customer
406,  Moment just announced their MagSafe compatible lineup,iphone,moment announced magsafe compatible lineup
407,Will reviewers get the iPhone 12 Pro Max too  And will the bargo be lifted on Tuesday before launch just like the first one  Review unit of iPhone 12 Pro Max,iphone,reviewer get pro max bargo lifted tuesday launch like first one review unit pro max
408,  First iPhone 13 Prototype resembles iPhone 12 and doesn t have in display Touch ID  Tipster,iphone,first prototype resembles display touch id tipster
409,"iPhone 12 mini Battery seems to be as good as iPhone XS Max battery as per apple  So doesn t that mean it is quite damn good  

 iPhone comparision  https   i imgur com sfNRQZR jpg  On iPhone 12 mini Battery",iphone,mini battery seems good x max battery per apple mean quite damn good comparision http imgur sfnrqzr jpg mini battery
410,"Even though the new iPhones look great  the only thing I d really want to update for from my iPhone 11 to the 12 is the new MagSafe system  I am sure that accessory manufacturers will release MagSafe cases for older models too  but as I found the perfect case for me at  PhoneRebel  https   phonerebel com   I would love to add MagSafe to my existing case myself  
I thought about carving the circle for the magnets out of the back of the case and add neodymium magnets to achieve a similar magnet array as the original magnets  As I want it to be compatible with the original system and the accessories  I was searching  unsuccessfully  for some resources to get information about the exact numbers and orientation of those magnets 
Has anyone an idea where I can get those documentations  if any are available at all  Are there any resources to create own MagSafe case ",iphone,even though new look great thing really want update new magsafe system sure accessory manufacturer release magsafe case older model found perfect case phonerebel http phonerebel would love add magsafe existing case thought carving circle magnet back case add neodymium magnet achieve similar magnet array original magnet want compatible original system accessory searching unsuccessfully resource get information exact number orientation magnet anyone idea get documentation available resource create magsafe case
411,  12 pro vs Xs if anybody is interested  I preferred the darker colour but oh well ,iphone,pro v x anybody interested preferred darker colour oh well
412,  iPhone 12 and iPhone 12 Pro run out of battery in 3 hours playing games,iphone,pro run battery hour playing game
413,"I ve seen lots of polls about iPhone 12 model and colors but none that I could find for storage options  Which storage option do you prefer for your phone and why 

 View Poll  https   www reddit com poll jmgsz4  Poll  Preferred iPhone Storage Option",iphone,seen lot poll model color none could find storage option storage option prefer view poll http poll jmgsz poll preferred storage option
414,"Welcome to the Daily Tech Support thread for  r iphone  

Have a question you need answered  Ask away  Please remember to adhere to our rules  which can be found in the sidebar  As usual  if you have a serious issue with the subreddit  please contact  the moderators directly   https   www reddit com message compose to  2Fr 2Fiphone 

Please be informed that any questions about bypassing iCloud lock   or anything similar that may infer that you are trying to get access to a locked iPhone  are no longer allowed and will be removed  Thank you 

Check our  Tech Support FAQ page  https   www reddit com r iphone wiki support faq 

Join our Discord room for support 

 Discord  https   discord gg iphone 

  Note  Comments are sorted by  new for your convenience   

This is the previous  archive  https   www reddit com r iphone search q title 3A 22Daily Tech Support Thread 22 author 3A 22AutoModerator 22 amp restrict_sr on amp sort new amp t all  of all previous  Daily Tech Support  threads  This is best viewed on a browser  If on mobile  type on the searchbar  title  Daily Tech Support Thread  author  AutoModerator    without the brackets  and including the quotation marks around the title and author     

Here is a previous  archive  https   www reddit com r iphone search q title 3A 22Weekly Tech Support Thread 22 author 3A 22AutoModerator 22 amp restrict_sr on amp sort new amp t all  of all previous  Weekly Tech Support  threads  which has now changed to Daily Tech Support Thread  This is best viewed on a browser  If on mobile  type on the searchbar  title  Weekly Tech Support Thread  author  AutoModerator    without the brackets  and including the quotation marks around the title and author   Daily Tech Support Thread    November 02 ",iphone,welcome daily tech support r question need answered ask away please remember adhere rule found sidebar usual serious issue subreddit please contact moderator directly http message compose fr fiphone please informed question bypassing icloud lock anything similar may infer trying get access locked longer allowed removed thank check tech support faq page http r wiki support faq join discord room support discord http discord gg note comment sorted new convenience previous archive http r search q title daily tech support author automoderator restrict sr sort new previous daily tech support thread best viewed browser mobile type searchbar title daily tech support author automoderator without bracket including quotation mark around title author previous archive http r search q title weekly tech support author automoderator restrict sr sort new previous weekly tech support thread changed daily tech support best viewed browser mobile type searchbar title weekly tech support author automoderator without bracket including quotation mark around title author daily tech support november
415,Battery is making me a little nervous after reading reviews  currently have a OnePlus 7 Pro and battery isn t amazing on it so hoping the 12 is better  What has your experience been  in terms of SoT and usage  How are 12 Pro users finding their battery ,iphone,battery making little nervous reading review currently oneplus pro battery amazing hoping better experience term sot usage pro user finding battery
416,I m planning on upgrading from my iPhone X to a XS as my phone is extremely damaged  My main concern is the PVD coating on my black iPhone X has come off completely in some areas of the bands even with wearing a case  Did apple fix this for the iPhone XS or is it still the same   Does the PVD coating on the IPhone XS stainless steel bands rub off  ,iphone,planning upgrading x x extremely damaged main concern pvd coating black x come completely area band even wearing case apple fix x still pvd coating x stainless steel band rub
417,"This is directed at people who prefer using cases and screen protectors coming from an average user who isn t doing a lot of outdoor or extreme activities  

Given that there are 2 3 lens on the 11 and 12 s the whole camera unit of the phone takes up more surface area and sticks out from the body of the phone  there s more of it at risk of scratches and breaking  I know most cases lift up the phone enough so that the lens don t lay flat on a table  but is that enough 

I m coming from a single lens phone and over the years of use I have wiped away smudges with my fingers and clothes without any thought  but something about the size of the camera unit on current phones makes me think I may need to take the extra precaution   I mean  nobody with a DSLR would leave the lens uncovered all the time  and while it is bigger and more expensive  a phone undergoes way more daily use for the average person  

These products are not very expensive  but it raises the question about their quality and if they cause distortion to the image  Because then the trade off of increased protection but decreased usefulness wouldn t be worth it  

  


 Example Lens Protector  https   preview redd it apc22z5a6pw51 png width 179 amp format png amp auto webp amp s 9d4a0d2a44bebf949f7da6e761c614094d6eb551  Do you think it s worth getting a glass camera lens protector ",iphone,directed people prefer using case screen protector coming average user lot outdoor extreme activity given lens whole camera unit take surface area stick body risk scratch breaking know case lift enough lens lay flat table enough coming single lens year use wiped away smudge finger clothes without thought something size camera unit current phone make think may need take extra precaution mean nobody dslr would leave lens uncovered time bigger expensive undergoes way daily use average person product expensive raise question quality cause distortion image trade increased protection decreased usefulness worth example lens protector http preview redd apc z pw png width format png auto webp bebf f da e c eb think worth getting glass camera lens protector
418,I ordered the clear Apple case but it s not here for a few days    my MagSafe charger gets here tomorrow  Currently using the clear Otterbox symmetry on my iPhone 12 Pro  Just curious if anybody has tested if there s a connection with the MagSafe through the case and how strong it is if there is one  Has anybody tried the MagSafe charger with an Otterbox symmetry case ,iphone,ordered clear apple case day magsafe charger get tomorrow currently using clear otterbox symmetry pro curious anybody tested connection magsafe case strong one anybody tried magsafe charger otterbox symmetry case
419,Will there be official leather cases for the iPhone 12 mini  I know that preorder for leather cases starts on friday but I guess this is only for the pro models  right  iPhone 12 mini leather case ,iphone,official leather case mini know preorder leather case start friday guess pro model right mini leather case
420,  MagSafe   Aukey Car Mount    overkill  Maybe  but for the here and now it gets the job done nicely,iphone,magsafe aukey car mount overkill maybe get job done nicely
421,  Apple Store closures could lead to iPhone Upgrade Program customers in England not getting the iPhone 12 mini or iPhone 12 Pro Max until December,iphone,apple store closure could lead upgrade program customer england getting mini pro max december
422,For those who don t know  all iPhone 12 models get 5g but only those sold in the USA also get a mmwave antenna  This is even faster than standard 5g  but the signal is very short range so requires transmitters everywhere  If the 12 was designed to accommodate the mmwave antenna  why did apple decide to leave it out in international markets  They don t even use the empty space for any other components according to  this video   https   youtu be FY7DtKMBxBw  Why is mmwave 5g unavailable on iPhone 12 in most countries ,iphone,know model get g sold usa also get mmwave antenna even faster standard g signal short range requires transmitter everywhere designed accommodate mmwave antenna apple decide leave international market even use empty space component according video http youtu fy dtkmbxbw mmwave g unavailable country
423,What s the Dolby vision bitrate for 4K 60fps  I ve heard somewhere that it s the same as regular 4K  which is a bummer of true since Dolby vision needs  a higher bitrate due to more data  Dolby vision bitrate ,iphone,dolby vision bitrate k fps heard somewhere regular k bummer true since dolby vision need higher bitrate due data dolby vision bitrate
424,  Fantastic idea ,iphone,fantastic idea
425,  iPhone 12 has capabilities to reverse wireless charge accessories already in it   E3550A SMARTPHONE RF Exposure Info FCC IC RF EXPOSURE REPORT Apple ,iphone,capability reverse wireless charge accessory already e smartphone rf exposure info fcc ic rf exposure report apple
426,"Considering all the low light improvements  can it actually shoot a proper low light portrait  like this  https   duckduckgo com  q night portrait amp t osx amp iar images amp iax images amp ia images   Does anyone have a DSLR with a portrait lens they can compare relative results with 

 amp  x200B 

I ve taken great portraits with my XS in great lightening   day time and not overly complicated haired subjects and it was great  but its always been an absolute potato in low light so trying to see if I can actually get great mileage on that front  How is the iPhone 12 pro  and potentially max  in low light portraits ",iphone,considering low light improvement actually shoot proper low light portrait like http duckduckgo q night portrait osx iar image iax image ia image anyone dslr portrait lens compare relative result x b taken great portrait x great lightening day time overly complicated haired subject great always absolute potato low light trying see actually get great mileage front pro potentially max low light portrait
427,"  Bigger screen by 0 2 inches

  5g

  Dolby Vision HDR video recording up to 60 fps

  increased zoom ranage by 1x

  LiDAR Scanner for Night mode portraits 

  faster autofocus in low light  and next level AR experiences

   faster processor

  Ceramic Shield front

  4x better drop performance

  2 meters more on water resistance

  A bit taller

  More width by 0 3mm

  Less  depth

  Apple ProRAW

  Sensor shift optical image stabilization

  0 5x better optical zoom 2x optical zoom ranage Digital zoom x2 more

  Night mode portraits

  Smart HDR 3 for photos

  HDR video recording with Dolby Vision up to 60 fps  the selling point 

  Sensor shift optical image stabilization for video

  0 5 x better optical zoom in 1x more Digital zoom up

  Night mode Time lapse

  Smart HDR 3 for photos

  HDR video recording with Dolby Vision up to 30 fps stop 

  Deep Fusion  the iphone 11 has that too i think 

  MagSafe

  2 more gb of ram

  And last but not least the squared edges

Edit Sorry for the bad english i had some spelling mistakes that i had to fix plus i missed a lot of things hopefully theres nothing missing   What the 12 pro max has that the 11 pro max dosent",iphone,bigger screen inch g dolby vision hdr video recording fps increased zoom ranage x lidar scanner night mode portrait faster autofocus low light next level ar experience faster processor ceramic shield front x better drop performance meter water resistance bit taller width mm le depth apple proraw sensor shift optical image stabilization x better optical zoom x optical zoom ranage digital zoom x night mode portrait smart hdr photo hdr video recording dolby vision fps selling point sensor shift optical image stabilization video x better optical zoom x digital zoom night mode time lapse smart hdr photo hdr video recording dolby vision fps stop deep fusion think magsafe gb ram last least squared edge edit sorry bad english spelling mistake fix plus missed lot thing hopefully there nothing missing pro max pro max dosent
428,"

 View Poll  https   www reddit com poll jm6uo8  Still not sure what phone to get",iphone,view poll http poll jm uo still sure get
