,title/text,subreddit,cleaned_text
169,Pro tip  when ordering online you can select any  carrier  specific iPhone when selecting  activate with carrier later   one time full payment option is selcted as the only difference is which carrier specific sim card is included in the box  For example  my local apple store was out of stock of  sim free  iPhones however I was able to secure the color and gb size I wanted of an  at amp t  version in stock  When I arrived to the store I just asked that they activate a 5G t mobile sim card and all was well  Apple Store Online Ordering Pro Tip,iphone,pro tip ordering online select carrier specific selecting activate carrier later one time full payment option selcted difference carrier specific sim card included box example local apple store stock sim free however able secure color gb size wanted version stock arrived store asked activate g mobile sim card well apple store online ordering pro tip
170,"I relied a lot on using 3D Touch on the keyboard to move the text cursor around and thought I d lose that entirely in the transition  Turns out you just need to long press the space key to replicate the same functionality 

Sharing this in case there s other people like me who rely on enjoy that feature 

If anyone else knows of any 3D Touch migration tips that new iPhone 12 or 11 users should know  please feel free to share below 

Thanks  Tip for users of 3D Touch devices migrating to the latest ",iphone,relied lot using touch keyboard move text cursor around thought lose entirely transition turn need long press space key replicate functionality sharing case people like rely enjoy feature anyone else know touch migration tip new user know please feel free share thanks tip user touch device migrating latest
171,"For what it s worth  I have small hands and because of wrist issues  weak grip strength   I have never cared about using a phone one handed  but as I ve gotten older  have wanted the screen size for my ageing eyes so I always opt for the Max version 

I got my 12ProMax yesterday   The size is pretty comparable to the XSMax  but where I really notice the difference is in the weight of the phones   The 12ProMax is considerably heavier than the XSMax  even with a very light case and the XSMax in a heavier case   The 12ProMax is a very dense phone   

So if you re accustomed to using the XSMax one handed  and are worried about upgrading to the Pro Max   I don t think the size would be where you run into issues  but the weight might be  so keep that in mind or maybe make an appointment at the Apple store to put your hands on one before buying 

I don t have any regrets  it s a beautiful phone and I m looking forward to seeing what it s capable of   The camera alone makes it worth it to me and I know in a couple weeks  I probably won t even notice the difference in weight  12Pro Max vs XSMax   where I really notice the difference  for those concerned about size ",iphone,worth small hand wrist issue weak grip strength never cared using one handed gotten older wanted screen size ageing eye always opt max version got promax yesterday size pretty comparable xsmax really notice difference weight phone promax considerably heavier xsmax even light case xsmax heavier case promax dense accustomed using xsmax one handed worried upgrading pro max think size would run issue weight might keep mind maybe make appointment apple store put hand one buying regret beautiful looking forward seeing capable camera alone make worth know couple week probably even notice difference weight pro max v xsmax really notice difference concerned size
172,"Hello 

So at time of writing I ve been using my PM for about 24 hours now  I upgraded from an iPhone X 

Some   personal   thoughts 

 amp  x200B 

Pros 

 The battery   Feels absolutely insane  I have about 2h screen on time since charging today  and the battery is at 79  at the moment  Downloaded loads of apps and thousands of spotify songs yesterday  battery was at 60  ish when plugging it into the charger  Such a MASSIVE upgrade from my X which never lasted an entire day for me in the end 

 The size   It s pretty much perfect I would say  I have average sized hands and haven t noticed any problems with one handed usage  It fits pretty good in my pocket  nothing more to say there really  Also the new design just feels sooo good in my hands 

 The RAM   My old X couldn t handle more than 3 4 apps sometimes before killing a background process  It happened waaay too many times that I browsed youtube  opened up snapchat and reddit  then when going back to youtube it reloaded the app  Haven t happened yet on my PM  despite opening way more apps 

 amp  x200B 

Neutral 

 The cameras   I am not a photographer and I did   not   buy this phone for the cameras  Most of my camera roll is just saved memes from Reddit  However  after comparing photos from both my X and my 12 PM  the differences are noticeable  but not major in any way  It feels better in low light  though  Will probably do some more testing when the weather is not 1000  rain 

 The price   Let s be real  most people buying this phone is not on a budget  You buy this if you want the best  Phones these days   are   expensive  I think the argument  how can a phone cost 1k that s insane  is ridiculous  It s not for you then  Just get a cheaper one 

 amp  x200B 

Cons 

I have to say  the weight   This is expected from such a big phone obviously  however  especially when lying in bed and watching youtube or whatever  my hand gets really tired after a while  I find it hard to use the phone one handed for longer periods 

 3D touch   I have to add this  It was such a nice feature on my X to just press hard anywhere on the keyboard to move the cursor  Now I have to press long on the spacebar  takes some time getting used to 

Questions  Thoughts from other Pro Max users  iPhone 12 Pro Max   First 24 hours thoughts ",iphone,hello time writing using pm hour upgraded x personal thought x b pro battery feel absolutely insane h screen time since charging today battery moment downloaded load apps thousand spotify song yesterday battery ish plugging charger massive upgrade x never lasted entire day end size pretty much perfect would say average sized hand noticed problem one handed usage fit pretty good pocket nothing say really also new design feel sooo good hand ram old x handle apps sometimes killing background process happened waaay many time browsed youtube opened snapchat going back youtube reloaded app happened yet pm despite opening way apps x b neutral camera photographer buy camera camera roll saved meme however comparing photo x pm difference noticeable major way feel better low light though probably testing weather rain price let real people buying budget buy want best phone day expensive think argument cost k insane ridiculous get cheaper one x b con say weight expected big obviously however especially lying bed watching youtube whatever hand get really tired find hard use one handed longer period touch add nice feature x press hard anywhere keyboard move cursor press long spacebar take time getting used question thought pro max user pro max first hour thought
173,"So I got the 12 pro max at launch yesterday and it is a great phone  I am happy with the purchase  However as I ve been using it  granted for a day so far  it dawned on me that I personally do not feel like my experience has changed in any significant way compared to the 8 plus 

The OLED screen is supposed to be far superior and probably is  but unless I put both phones next to one another I honestly couldn t tell much about it  The phone doesn t feel snappier in any way  which is understandable  as the 8 plus A11 is still more than capable for years to come and you can only get so  snappy   Probably a higher refresh rate display would have made me feel like I got a  jump  in performance  but alas Apple did not give us one with the 12 line up  

Face ID is a nice quality of life change from Touch ID  no more dreading sweaty fingers   but in the era of face masks in a pandemic  which will likely continue through 2021  it is losing its flair  

It s early to talk about battery life  the 8 plus lasted me at least a day and half  I don t expect different from the 12 pro max   but again this is likely to be another user experience feature  which barely differs between the two phones    


This post is more of a props for the 8 plus  than dissing the 12 pro max  The 12 pro max is great  I just don t feel like it s tangibly greater than the 8 plus in daily non specialized use  Sure  it s a Pro  it s meant for the  power users   but honestly you can get the same value of power usage in the older phones  As old as t he 8 plus as evidenced by my experience  I honestly feel like after the 8 plus it has become incredibly difficult to actually upgrade the user experience and all the advancements  such as LIDAR  bigger camera sensor  etc  have been very niche and honestly felt by a very small percentage of the user base  For the casual one shot photo snapper who needs a reliable phone  the new iPhone lineups have failed to deliver any tangible improvements  that s the case across all smartphones  but Apple is the only manufacture to have 3 4 year old phones  which are completely viable to use today    


The 8 plus was my first iPhone and this experience upgrading makes me recommend  buying two generations behind simply for price experience ratio  As things stand I could not suggest you actually pay this money for any reason other than  got the newest phone   You can use your phone until it gets dropped by software support and be confident you are not missing much  8 plus to 12 pro max   doesn t feel like much of an upgrade",iphone,got pro max launch yesterday great happy purchase however using granted day far dawned personally feel like experience changed significant way compared plus oled screen supposed far superior probably unless put phone next one another honestly tell much feel snappier way understandable plus still capable year come get snappy probably higher refresh rate display would made feel like got jump performance ala apple give u one line face id nice quality life change touch id dreading sweaty finger era face mask pandemic likely continue losing flair early talk battery life plus lasted least day half expect different pro max likely another user experience feature barely differs two phone post prop plus dissing pro max pro max great feel like tangibly greater plus daily non specialized use sure pro meant power user honestly get value power usage older phone old plus evidenced experience honestly feel like plus become incredibly difficult actually upgrade user experience advancement lidar bigger camera sensor etc niche honestly felt small percentage user base casual one shot photo snapper need reliable new lineup failed deliver tangible improvement case across smartphones apple manufacture year old phone completely viable use today plus first experience upgrading make recommend buying two generation behind simply price experience ratio thing stand could suggest actually pay money reason got newest use get dropped software support confident missing much plus pro max feel like much upgrade
174,  iFixit shares first part of its  small bodied  iPhone 12 mini teardown   9to5Mac,iphone,ifixit share first part small bodied mini teardown mac
175,"Hello  I just wanted to share what I did just now 

For the past few years I ve been a huge fan of magnetic mounts  in the car and around the home  I ve been using the Scosche mounts for many years  and with the announcement of the MagSafe mounts that was quite exciting for me 

As MagSafe on iPhone is in the infancy and there are a handful of products announced  though nothing available for purchase other then the Apple MagSafe charger  I came up with my own mount 

I m using an Arkon brand floor mount  attached to seat bolt  which has an AMPS bracket  The only reason I m using this is my car has no real ideal dash mount spot  BMW i3   With the bracket I used some 3M command strips to stick the Apple charger to the ball head 

I don t have pics of the phone on it  as I didn t bring my other phone and it s cold out right now  Though I m quite satisfied with it  and I have the phone a good shake and it holds strong  This is with the weight of a 12 pro max with an Apple case on it 

https   imgur com gallery Koy9uh3

edit  got me a Imgur account and added photos iPhone 12 MagSafe car mount",iphone,hello wanted share past year huge fan magnetic mount car around home using scosche mount many year announcement magsafe mount quite exciting magsafe infancy handful product announced though nothing available purchase apple magsafe charger came mount using arkon brand floor mount attached seat bolt amp bracket reason using car real ideal dash mount spot bmw bracket used command strip stick apple charger ball head pic bring cold right though quite satisfied good shake hold strong weight pro max apple case http imgur gallery koy uh edit got imgur account added photo magsafe car mount
176,  iPhone 12 Mini users reporting day 1 lock screen touch sensitivity issues,iphone,mini user reporting day lock screen touch sensitivity issue
177,"Welcome to the Daily Tech Support thread for  r iphone  

Have a question you need answered  Ask away  Please remember to adhere to our rules  which can be found in the sidebar  As usual  if you have a serious issue with the subreddit  please contact  the moderators directly   https   www reddit com message compose to  2Fr 2Fiphone 

Please be informed that any questions about bypassing iCloud lock   or anything similar that may infer that you are trying to get access to a locked iPhone  are no longer allowed and will be removed  Thank you 

Check our  Tech Support FAQ page  https   www reddit com r iphone wiki support faq 

Join our Discord room for support 

 Discord  https   discord gg iphone 

  Note  Comments are sorted by  new for your convenience   

This is the previous  archive  https   www reddit com r iphone search q title 3A 22Daily Tech Support Thread 22 author 3A 22AutoModerator 22 amp restrict_sr on amp sort new amp t all  of all previous  Daily Tech Support  threads  This is best viewed on a browser  If on mobile  type on the searchbar  title  Daily Tech Support Thread  author  AutoModerator    without the brackets  and including the quotation marks around the title and author     

Here is a previous  archive  https   www reddit com r iphone search q title 3A 22Weekly Tech Support Thread 22 author 3A 22AutoModerator 22 amp restrict_sr on amp sort new amp t all  of all previous  Weekly Tech Support  threads  which has now changed to Daily Tech Support Thread  This is best viewed on a browser  If on mobile  type on the searchbar  title  Weekly Tech Support Thread  author  AutoModerator    without the brackets  and including the quotation marks around the title and author   Daily Tech Support Thread    November 14 ",iphone,welcome daily tech support r question need answered ask away please remember adhere rule found sidebar usual serious issue subreddit please contact moderator directly http message compose fr fiphone please informed question bypassing icloud lock anything similar may infer trying get access locked longer allowed removed thank check tech support faq page http r wiki support faq join discord room support discord http discord gg note comment sorted new convenience previous archive http r search q title daily tech support author automoderator restrict sr sort new previous daily tech support thread best viewed browser mobile type searchbar title daily tech support author automoderator without bracket including quotation mark around title author previous archive http r search q title weekly tech support author automoderator restrict sr sort new previous weekly tech support thread changed daily tech support best viewed browser mobile type searchbar title weekly tech support author automoderator without bracket including quotation mark around title author daily tech support november
178,  Renowned Apple Analyst Exposes What To Expect In The Next gen iPhone SE,iphone,renowned apple analyst expose expect next gen se
179,  iPhone 12 Missing SMS Text Messages,iphone,missing sm text message
180,"Is anybody else thinking about hoping for a Mini malist  Mode or similar feature for the iPhone Mini  It occurred to me today that  mini  is certainly about size  but also may be about life impact and how much  real estate  our technology occupies in our lives 

Personally I d love to see a more robust approach to MINImizing phone use  more useful  Screen Time  alerts  new home screen layouts to maximize taskbar items and most frequently used apps  temporarily disabling social media apps if desired  some sort of virtual  lockbox  like the Freedom app  etc 

Anybody else interested in something like this  I ve tried reverting to a flip phone  which I loved but it wasn t sustainable with work and life   and the Palm smartphone is nifty but so powerless  and also iOS is much more pleasant when you re used to that ecosystem   I ve been dreaming of another SE  2016  sized phone and am so glad Apple is making small er  phones again  iPhone Mini malist  ",iphone,anybody else thinking hoping mini malist mode similar feature mini occurred today mini certainly size also may life impact much real estate technology occupies life personally love see robust approach minimizing use useful screen time alert new home screen layout maximize taskbar item frequently used apps temporarily disabling social medium apps desired sort virtual lockbox like freedom app etc anybody else interested something like tried reverting flip loved sustainable work life palm smartphone nifty powerless also io much pleasant used ecosystem dreaming another se sized glad apple making small er phone mini malist
181,   Poll  Which iPhone introduced in 2020 is the best value ,iphone,poll introduced best value
182,  Halide Blog  iPhone 12 Pro Max Hardware Changes,iphone,halide blog pro max hardware change
183,  Some iPhone 12 Pro displays have an issue where it flickers at brightness levels lower than 90   This results in an ugly glow or a bright grey tint across the entire display when displaying blacks ,iphone,pro display issue flicker brightness level lower result ugly glow bright grey tint across entire display displaying black
184,   Crosspost With the upcoming discontinuation of Google Photos  free storage  this is just a reminder that iCloud Photo Sharing allows for nearly unlimited  free photo and video storage as well,iphone,crosspost upcoming discontinuation google photo free storage reminder icloud photo sharing allows nearly unlimited free photo video storage well
185,"Welcome to the weekly stickied WSIB thread  

Have any questions about buying  selling  trading  or giveaways  Ask away  Please remember to adhere to our rules  which can be found in the sidebar  As usual  if you have a serious issue with the subreddit  please contact  the moderators directly   https   www reddit com message compose to  2Fr 2Fiphone  

Join our Discord room for support 

 Discord  https   discord gg iphone 

  Note  Comments are sorted by  new for your convenience   

Here is an  archive  https   www reddit com r iphone search q title 3A 22What Should I Buy 22 author 3A 22AutoModerator 22 amp restrict_sr on amp sort new amp t all  of all previous  What Should I Buy  threads  This is best viewed on a browser  If on mobile  type on the searchbar  title  What Should I Buy  author  AutoModerator    without the brackets  and including the quotation marks around the title and author   Weekly What Should I Buy Thread    November 13 ",iphone,welcome weekly stickied wsib question buying selling trading giveaway ask away please remember adhere rule found sidebar usual serious issue subreddit please contact moderator directly http message compose fr fiphone join discord room support discord http discord gg note comment sorted new convenience archive http r search q title buy author automoderator restrict sr sort new previous buy thread best viewed browser mobile type searchbar title buy author automoderator without bracket including quotation mark around title author weekly buy november
186,  First iPhone 12 mini and iPhone 12 Pro Max pre orders now arriving to customers,iphone,first mini pro max pre order arriving customer
187,"Welcome to the Daily Tech Support thread for  r iphone  

Have a question you need answered  Ask away  Please remember to adhere to our rules  which can be found in the sidebar  As usual  if you have a serious issue with the subreddit  please contact  the moderators directly   https   www reddit com message compose to  2Fr 2Fiphone 

Please be informed that any questions about bypassing iCloud lock   or anything similar that may infer that you are trying to get access to a locked iPhone  are no longer allowed and will be removed  Thank you 

Check our  Tech Support FAQ page  https   www reddit com r iphone wiki support faq 

Join our Discord room for support 

 Discord  https   discord gg iphone 

  Note  Comments are sorted by  new for your convenience   

This is the previous  archive  https   www reddit com r iphone search q title 3A 22Daily Tech Support Thread 22 author 3A 22AutoModerator 22 amp restrict_sr on amp sort new amp t all  of all previous  Daily Tech Support  threads  This is best viewed on a browser  If on mobile  type on the searchbar  title  Daily Tech Support Thread  author  AutoModerator    without the brackets  and including the quotation marks around the title and author     

Here is a previous  archive  https   www reddit com r iphone search q title 3A 22Weekly Tech Support Thread 22 author 3A 22AutoModerator 22 amp restrict_sr on amp sort new amp t all  of all previous  Weekly Tech Support  threads  which has now changed to Daily Tech Support Thread  This is best viewed on a browser  If on mobile  type on the searchbar  title  Weekly Tech Support Thread  author  AutoModerator    without the brackets  and including the quotation marks around the title and author   Daily Tech Support Thread    November 13 ",iphone,welcome daily tech support r question need answered ask away please remember adhere rule found sidebar usual serious issue subreddit please contact moderator directly http message compose fr fiphone please informed question bypassing icloud lock anything similar may infer trying get access locked longer allowed removed thank check tech support faq page http r wiki support faq join discord room support discord http discord gg note comment sorted new convenience previous archive http r search q title daily tech support author automoderator restrict sr sort new previous daily tech support thread best viewed browser mobile type searchbar title daily tech support author automoderator without bracket including quotation mark around title author previous archive http r search q title weekly tech support author automoderator restrict sr sort new previous weekly tech support thread changed daily tech support best viewed browser mobile type searchbar title weekly tech support author automoderator without bracket including quotation mark around title author daily tech support november
188,  Video found in iOS 14 3 beta shows potential design of AirPods Studio  AirTags pairing process shown too,iphone,video found io beta show potential design airpods studio airtags pairing process shown
189,"I was thinking of getting a new base model iPod Touch  but seeing the Black Friday offer from Walmart I d rather get the SE for the same price 

Can I just never activate it with Straight Talk and use it as a Touch  Can I use the Straight Talk  199 iPhone SE from Walmart just as an iPod Touch ",iphone,thinking getting new base model ipod touch seeing black friday offer walmart rather get se price never activate straight talk use touch use straight talk se walmart ipod touch
190,"Hi guys 

This goes mainly to the one who do not use a screen protector 

How is your screen holding up  Any scratches  Does it feel like it s less resistent to scratches  Or is it more a thing how you handle your stuff 

I m curious for your experiences  iPhone 12   Pro User   how is your screen after weeks of usage ",iphone,hi guy go mainly one use screen protector screen holding scratch feel like le resistent scratch thing handle stuff curious experience pro user screen week usage
191,I tried searching  but couldn t find a definitive answer  What happens if your charger doesn t support 9V 2 2A  Does it then default to 9V 2A or 5V 3A  I am asking about iPhone 12 specifically and direct lightning cable  not MagSafe   iPhone 12 Chargers  amp  Voltage Amperage Wattage,iphone,tried searching find definitive answer happens charger support v default v v asking specifically direct lightning cable magsafe charger voltage amperage wattage
192,  LIDAR 3D Sanner App Test   Works on people if they are still enough,iphone,lidar sanner app test work people still enough
193,  OtterBox Apple iPhone 12 Mini Max Commuter Cases for  26 99  Not as great of a deal as yesterday s post for the Defender Pro  but a discount is a discount  Many big box stores will likely price match ,iphone,otterbox apple mini max commuter case great deal yesterday post defender pro discount discount many big box store likely price match
194,   x post from  r apple  iPhone 12 Pro Max vs iPhone 12 Pro Video Stabilization Test by Danny Winget,iphone,x post r apple pro max v pro video stabilization test danny winget
